[
  { "user_id": "demo-user-001", "date": "2026-06-01", "bodyweight_kg": 82.0, "sleep_hours": 7.5, "sleep_quality": 4, "hrv_ms": 62, "resting_hr": 54, "mood": 4, "stress": 2, "energy": 4, "protein_target_hit": "yes", "soreness": { "chest": 0, "quadriceps": 1 }, "source": { "sleep_hours": "wearable", "hrv_ms": "wearable", "bodyweight_kg": "smart-scale" } },
  { "user_id": "demo-user-001", "date": "2026-06-02", "bodyweight_kg": 81.6, "sleep_hours": 6.8, "sleep_quality": 3, "hrv_ms": 55, "resting_hr": 57, "mood": 3, "stress": 3, "energy": 3, "protein_target_hit": "roughly", "soreness": { "chest": 2, "side-delts": 2 }, "source": { "sleep_hours": "wearable", "hrv_ms": "wearable", "bodyweight_kg": "smart-scale" } },
  { "user_id": "demo-user-001", "date": "2026-06-03", "bodyweight_kg": 81.8, "sleep_hours": 8.1, "sleep_quality": 5, "hrv_ms": 68, "resting_hr": 52, "mood": 4, "stress": 2, "energy": 5, "protein_target_hit": "yes", "source": { "sleep_hours": "wearable", "hrv_ms": "wearable", "bodyweight_kg": "smart-scale" } },
  { "user_id": "demo-user-001", "date": "2026-06-04", "bodyweight_kg": 82.1, "sleep_hours": 7.2, "sleep_quality": 4, "hrv_ms": 60, "resting_hr": 55, "mood": 4, "stress": 2, "energy": 4, "protein_target_hit": "yes", "soreness": { "quadriceps": 2, "hamstrings": 2, "glutes": 1 }, "source": { "sleep_hours": "wearable", "hrv_ms": "wearable", "bodyweight_kg": "smart-scale" } },
  { "user_id": "demo-user-001", "date": "2026-06-05", "bodyweight_kg": 82.3, "sleep_hours": 7.0, "sleep_quality": 3, "hrv_ms": 58, "resting_hr": 56, "mood": 3, "stress": 3, "energy": 3, "protein_target_hit": "no", "source": { "sleep_hours": "wearable", "hrv_ms": "wearable", "bodyweight_kg": "smart-scale" } },
  { "user_id": "demo-user-001", "date": "2026-06-06", "bodyweight_kg": 82.4, "sleep_hours": 8.4, "sleep_quality": 5, "hrv_ms": 70, "resting_hr": 51, "mood": 5, "stress": 1, "energy": 5, "protein_target_hit": "yes", "source": { "sleep_hours": "wearable", "hrv_ms": "wearable", "bodyweight_kg": "smart-scale" } },
  { "user_id": "demo-user-001", "date": "2026-06-07", "bodyweight_kg": 82.2, "sleep_hours": 7.6, "sleep_quality": 4, "hrv_ms": 64, "resting_hr": 53, "mood": 4, "stress": 2, "energy": 4, "protein_target_hit": "yes", "source": { "sleep_hours": "wearable", "hrv_ms": "wearable", "bodyweight_kg": "smart-scale" } },
  { "user_id": "demo-user-001", "date": "2026-06-08", "bodyweight_kg": 82.3, "sleep_hours": 7.3, "sleep_quality": 4, "hrv_ms": 61, "resting_hr": 54, "mood": 4, "stress": 2, "energy": 4, "protein_target_hit": "yes", "source": { "sleep_hours": "wearable", "hrv_ms": "wearable", "bodyweight_kg": "smart-scale" } },
  { "user_id": "demo-user-001", "date": "2026-06-09", "bodyweight_kg": 82.6, "sleep_hours": 6.9, "sleep_quality": 3, "hrv_ms": 57, "resting_hr": 56, "mood": 3, "stress": 3, "energy": 3, "protein_target_hit": "roughly", "source": { "sleep_hours": "wearable", "hrv_ms": "wearable", "bodyweight_kg": "smart-scale" } },
  { "user_id": "demo-user-001", "date": "2026-06-10", "bodyweight_kg": 82.5, "sleep_hours": 7.8, "sleep_quality": 4, "hrv_ms": 65, "resting_hr": 53, "mood": 4, "stress": 2, "energy": 4, "protein_target_hit": "yes", "source": { "sleep_hours": "wearable", "hrv_ms": "wearable", "bodyweight_kg": "smart-scale" } },
  { "user_id": "demo-user-001", "date": "2026-06-11", "bodyweight_kg": 82.7, "sleep_hours": 8.0, "sleep_quality": 5, "hrv_ms": 67, "resting_hr": 52, "mood": 5, "stress": 2, "energy": 5, "protein_target_hit": "yes", "source": { "sleep_hours": "wearable", "hrv_ms": "wearable", "bodyweight_kg": "smart-scale" } },
  { "user_id": "demo-user-001", "date": "2026-06-12", "bodyweight_kg": 82.6, "sleep_hours": 7.4, "sleep_quality": 4, "hrv_ms": 63, "resting_hr": 54, "mood": 4, "stress": 2, "energy": 4, "protein_target_hit": "yes", "source": { "sleep_hours": "wearable", "hrv_ms": "wearable", "bodyweight_kg": "smart-scale" } },
  { "user_id": "demo-user-001", "date": "2026-06-13", "bodyweight_kg": 82.9, "sleep_hours": 8.2, "sleep_quality": 5, "hrv_ms": 69, "resting_hr": 51, "mood": 5, "stress": 1, "energy": 5, "protein_target_hit": "yes", "source": { "sleep_hours": "wearable", "hrv_ms": "wearable", "bodyweight_kg": "smart-scale" } },
  { "user_id": "demo-user-001", "date": "2026-06-14", "bodyweight_kg": 82.8, "sleep_hours": 7.7, "sleep_quality": 4, "hrv_ms": 64, "resting_hr": 53, "mood": 4, "stress": 2, "energy": 4, "protein_target_hit": "yes", "source": { "sleep_hours": "wearable", "hrv_ms": "wearable", "bodyweight_kg": "smart-scale" } }
]
